B2: Home | Join | Weekly Walks | Courses | Results | Links

A1: Green background indicates a pending record. Records copied from USATF web site on March 29, 2006

A1: Women - USA 15km Race Walk Records
A2: Division | B2: Peformance | C2: Name | D2: Location | E2: Date | F2: Pace min/mile
A3: Juniors | B3: 5.7002314814814818E-2 | C3: Maria Michta | D3: Niagara Falls, NY | E3: 2005-Jun-04 | F3: 8:48
A4: Open | B4: 4.762731481481481E-2 | C4: Michelle Rohl | D4: Kenosha, WI | E4: 2000-May-13 | F4: =B3/(15*1000/1609) -> 5.108823302469135E-3
A5: 35-39 | B5: 4.8854166666666664E-2 | C5: Michelle Rohl | D5: Evansville, IN | E5: 2003-Jun-01 | F5: =B4/(15*1000/1609) -> 5.2404236111111106E-3
A6: 40-44 | B6: 5.3506944444444447E-2 | C6: Victoria Herazo | D6: Elk Grove, IL | E6: 2000-May-21 | F6: =B5/(15*1000/1609) -> 5.739511574074074E-3
A7: 40-44 | B7: 4.9108796296296296E-2 | C7: Teresa Vaill | D7: Lincoln, RI | E7: 2004-Jun-13 | F7: 7:35
A8: 45-49 | B8: 5.6759259259259259E-2 | C8: Sally Richards | D8: Monterey, CA | E8: 1999-Oct-23 | F8: =B7/(15*1000/1609) -> 6.0883765432098768E-3
A9: 50-54 | B9: 5.9988425925925924E-2 | C9: Gayle Johnson | D9: Kenosha, WI | E9: 2000-Jun-25 | F9: =B8/(15*1000/1609) -> 6.4347584876543202E-3
A10: 55-59 | B10: 6.0624999999999998E-2 | C10: JoAnn Nedelco | D10: Elk Grove, IL | E10: 1999-May-23 | F10: =B9/(15*1000/1609) -> 6.5030416666666665E-3
A11: 60-64 | B11: 6.6018518518518518E-2 | C11: Joyce Decker | D11: Kenosha, WI | E11: 1994-Sep-25 | F11: =B10/(15*1000/1609) -> 7.0815864197530864E-3
A12: 65-69 | B12: 6.8043981481481483E-2 | C12: Bev LaVeck | D12: Sacramento, CA | E12: 2002-May-05 | F12: =B11/(15*1000/1609) -> 7.2988510802469136E-3
A13: 70-74 | B13: 8.2881944444444453E-2 | C13: Rose Kash | D13: Riverside, CA | E13: 1992-May-24 | F13: =B12/(15*1000/1609) -> 8.8904699074074077E-3
A14: 75-79 | B14: 8.7083333333333332E-2 | C14: Adaline Crocker | D14: Eugene, OR | E14: 1987-Aug-16 | F14: =B13/(15*1000/1609) -> 9.3411388888888884E-3
A15: 80-84 | B15: 8.2430555555555562E-2 | C15: Jane Dana | D15: Riverside, CA | E15: 2002-May-19 | F15: =B14/(15*1000/1609) -> 8.8420509259259268E-3

A1: Men - USA 15km Race Walk Records
A2: Division | B2: Performance | C2: Name | D2: Location | E2: Date | F2: Pace min/mile
A3: Juniors | B3: 5.1122685185185181E-2 | C3: Troy Clark | D3: Lincoln, RI | E3: 2004-Jun-13 | F3: 7:54
A4: Open | B4: 4.2708333333333327E-2 | C4: Timothy Seaman | D4: Phonixmarsjen, DNK | E4: 2004-May-23 | F4: =B3/(15*1000/1609) -> 4.5811805555555545E-3
A5: 35-39 | B5: 4.4340277777777777E-2 | C5: Jonathan Matthews | D5: Palo Alto, CA | E5: 1993-May-23 | F5: =B4/(15*1000/1609) -> 4.7562337962962957E-3
A6: 40-44 | B6: 4.4467592592592593E-2 | C6: Jonathan Matthews | D6: Eugene, OR | E6: 1999-Jun-27 | F6: =B5/(15*1000/1609) -> 4.7698904320987653E-3
A7: 45-49 | B7: 4.927083333333334E-2 | C7: Larry Walker | D7: Long Beach, CA | E7: 1989-Apr-30 | F7: =B6/(15*1000/1609) -> 5.2851180555555559E-3
A8: 50-54 | B8: 5.1863425925925931E-2 | C8: Jim Carmines | D8: Elk Grove, IL | E8: 1998-May-24 | F8: =B7/(15*1000/1609) -> 5.5632168209876548E-3
A9: 55-59 | B9: 5.1898148148148145E-2 | C9: Don DeNoon | D9: Elk Grove, IL | E9: 1999-May-23 | F9: =B8/(15*1000/1609) -> 5.5669413580246912E-3
A10: 60-64 | B10: 5.5370370370370368E-2 | C10: Don DeNoon | D10: Elk Grove, IL | E10: 2003-Jun-10 | F10: =B9/(15*1000/1609) -> 5.9393950617283951E-3
A11: 60-64 | B11: 5.5324074074074074E-2 | C11: Leon Jasionowski | D11: Clermont, CA | E11: 2005-Nov-13 | F11: 8:33
A12: 65-69 | B12: 5.8634259259259254E-2 | C12: Max Green | D12: Elk Grove, IL | E12: 1998-May-24 | F12: =B11/(15*1000/1609) -> 6.2895015432098758E-3
A13: 70-74 | B13: 6.4421296296296296E-2 | C13: Bob Mimm | D13: Riverside, CA | E13: 1998-May-17 | F13: =B12/(15*1000/1609) -> 6.9102577160493825E-3
A14: 70-74 | B14: 6.3622685185185185E-2 | C14: Max Green | D14: Lincoln, RI | E14: 2004-Jun-13 | F14: 9:50
A15: 75-79 | B15: 6.9965277777777779E-2 | C15: Giulio DePetra | D15: Eugene, OR | E15: 1987-Aug-16 | F15: =B14/(15*1000/1609) -> 7.5049421296296296E-3
A16: 75-79 | B16: 6.8888888888888888E-2 | C16: Jack Starr | D16: Lincoln, RI | E16: 2004-Jun-13 | F16: 10:38
A17: 80-84 | B17: 7.7777777777777779E-2 | C17: Bob Mimm | D17: Riveride, CA | E17: 2005-May-15 | F17: =B16/(15*1000/1609) -> 8.3429629629629635E-3
A18: 85-89 | B18: 8.9791666666666659E-2 | C18: Tony Perona | D18: Riverside, CA | E18: 1995-May-21 | F18: 13:52

A1: Home | Join | Weekly Walks | Courses | Results | Links Copyright 2013 by Twin Cities Race Walkers. All Rights Reserved Contact Webmaster if you have any issues or problems with this web site.