A1: Judging Summary Sheet for USA 15km Race Walking Championships Recorder: Lauren Hill Date: August 19, 2007 Location: Minneapolis, MN

A1: Judges Names | C1: 1 - Chief | F1: 2 | I1: 3 | L1: 4 | O1: 5 | R1: 6 | U1: by competitor summary
C2: Wayne Armbrust | F2: Jeannie DeMartino | I2: Gary O'Daniels | L2: Bruce Leasure | O2: Jodie Olson | R2: Gary Westlund
A3: Competitor | C3: ~ | D3: > | E3: Red Card | F3: ~ | G3: > | H3: Red Card | I3: ~ | J3: > | K3: Red Card | L3: ~ | M3: > | N3: Red Card | O3: ~ | P3: > | Q3: Red Card | R3: ~ | S3: > | T3: Red Card | U3: ~ | V3: > | W3: # Red Cards | X3: DQ
A4: Name | B4: #
A5: Alva, Julio | B5: 67 | U5: =COUNTA(C5,F5,I5,L5,R5) -> 0 | V5: =COUNTA(D5,G5,J5,M5,S5) -> 0 | W5: =COUNTA(E5,H5,K5,N5,T5) -> 0 | X5: =IF(W5>=3,"DQ","") -> 
A6: Alva, Pamela | B6: 68 | D6: 0.36249999999999999 | M6: 0.34375 | U6: =COUNTA(C6,F6,I6,L6,R6) -> 0 | V6: =COUNTA(D6,G6,J6,M6,S6) -> 2 | W6: =COUNTA(E6,H6,K6,N6,T6) -> 0 | X6: =IF(W6>=3,"DQ","") -> 
A7: Atrushkevich, Alena | B7: 82 | U7: =COUNTA(C7,F7,I7,L7,R7) -> 0 | V7: =COUNTA(D7,G7,J7,M7,S7) -> 0 | W7: =COUNTA(E7,H7,K7,N7,T7) -> 0 | X7: =IF(W7>=3,"DQ","") -> 
A8: Borgen, Tish | B8: 89 | U8: =COUNTA(C8,F8,I8,L8,R8) -> 0 | V8: =COUNTA(D8,G8,J8,M8,S8) -> 0 | W8: =COUNTA(E8,H8,K8,N8,T8) -> 0 | X8: =IF(W8>=3,"DQ","") -> 
A9: Boyles, Matthew | B9: 90 | C9: 0.32916666666666666 | E9: ~8:17 | I9: 0.3354166666666667 | K9: ~8:26 | L9: 0.3298611111111111 | N9: ~8:21 | O9: X | R9: 0.34791666666666665 | U9: =COUNTA(C9,F9,I9,L9,R9) -> 4 | V9: =COUNTA(D9,G9,J9,M9,S9) -> 0 | W9: =COUNTA(E9,H9,K9,N9,T9) -> 3 | X9: =IF(W9>=3,"DQ","") -> DQ
A10: Burmeister, Jamie | B10: 69 | D10: 0.38055555555555554 | M10: 0.33333333333333331 | S10: 0.33333333333333331 | U10: =COUNTA(C10,F10,I10,L10,R10) -> 0 | V10: =COUNTA(D10,G10,J10,M10,S10) -> 3 | W10: =COUNTA(E10,H10,K10,N10,T10) -> 0 | X10: =IF(W10>=3,"DQ","") -> 
A11: Craig, Rod | B11: 93 | C11: 0.32361111111111113 | E11: >9:06 | G11: 0.3298611111111111 | U11: =COUNTA(C11,F11,I11,L11,R11) -> 1 | V11: =COUNTA(D11,G11,J11,M11,S11) -> 1 | W11: =COUNTA(E11,H11,K11,N11,T11) -> 1 | X11: =IF(W11>=3,"DQ","") -> 
A12: Daubert, Dave | B12: 70 | U12: =COUNTA(C12,F12,I12,L12,R12) -> 0 | V12: =COUNTA(D12,G12,J12,M12,S12) -> 0 | W12: =COUNTA(E12,H12,K12,N12,T12) -> 0 | X12: =IF(W12>=3,"DQ","") -> 
A13: Finch, Bernie | B13: 86 | J13: 0.3444444444444445 | K13: >9:13 | S13: 0.35625000000000001 | U13: =COUNTA(C13,F13,I13,L13,R13) -> 0 | V13: =COUNTA(D13,G13,J13,M13,S13) -> 2 | W13: =COUNTA(E13,H13,K13,N13,T13) -> 1 | X13: =IF(W13>=3,"DQ","") -> 
A14: Finch, Kathy | B14: 87 | D14: 0.32500000000000001 | U14: =COUNTA(C14,F14,I14,L14,R14) -> 0 | V14: =COUNTA(D14,G14,J14,M14,S14) -> 1 | W14: =COUNTA(E14,H14,K14,N14,T14) -> 0 | X14: =IF(W14>=3,"DQ","") -> 
A15: Heinlein, Lynette | B15: 83 | U15: =COUNTA(C15,F15,I15,L15,R15) -> 0 | V15: =COUNTA(D15,G15,J15,M15,S15) -> 0 | W15: =COUNTA(E15,H15,K15,N15,T15) -> 0 | X15: =IF(W15>=3,"DQ","") -> 
A16: Holcomb, Lori | B16: 71 | D16: 0.3298611111111111 | G16: 0.34027777777777773 | J16: 0.37152777777777773 | S16: 0.36319444444444443 | U16: =COUNTA(C16,F16,I16,L16,R16) -> 0 | V16: =COUNTA(D16,G16,J16,M16,S16) -> 4 | W16: =COUNTA(E16,H16,K16,N16,T16) -> 0 | X16: =IF(W16>=3,"DQ","") -> 
A17: Jasionowski, Leon | B17: 72 | U17: =COUNTA(C17,F17,I17,L17,R17) -> 0 | V17: =COUNTA(D17,G17,J17,M17,S17) -> 0 | W17: =COUNTA(E17,H17,K17,N17,T17) -> 0 | X17: =IF(W17>=3,"DQ","") -> 
A18: Kliewer, Sue | B18: 88 | U18: =COUNTA(C18,F18,I18,L18,R18) -> 0 | V18: =COUNTA(D18,G18,J18,M18,S18) -> 0 | W18: =COUNTA(E18,H18,K18,N18,T18) -> 0 | X18: =IF(W18>=3,"DQ","") -> 
A19: Login, Solomiya | B19: 73 | U19: =COUNTA(C19,F19,I19,L19,R19) -> 0 | V19: =COUNTA(D19,G19,J19,M19,S19) -> 0 | W19: =COUNTA(E19,H19,K19,N19,T19) -> 0 | X19: =IF(W19>=3,"DQ","") -> 
A20: Macias-Howard, Anita | B20: 74 | D20: 0.35625000000000001 | P20: X | S20: 0.3347222222222222 | U20: =COUNTA(C20,F20,I20,L20,R20) -> 0 | V20: =COUNTA(D20,G20,J20,M20,S20) -> 2 | W20: =COUNTA(E20,H20,K20,N20,T20) -> 0 | X20: =IF(W20>=3,"DQ","") -> 
A21: Marlborough, Jennifer | B21: 75 | U21: =COUNTA(C21,F21,I21,L21,R21) -> 0 | V21: =COUNTA(D21,G21,J21,M21,S21) -> 0 | W21: =COUNTA(E21,H21,K21,N21,T21) -> 0 | X21: =IF(W21>=3,"DQ","") -> 
A22: Moore, Jolene | B22: 66 | C22: 0.36805555555555558 | F22: 0.33055555555555555 | I22: 0.34375 | U22: =COUNTA(C22,F22,I22,L22,R22) -> 3 | V22: =COUNTA(D22,G22,J22,M22,S22) -> 0 | W22: =COUNTA(E22,H22,K22,N22,T22) -> 0 | X22: =IF(W22>=3,"DQ","") -> 
A23: Nichols, Robert A | B23: 76 | D23: 0.34513888888888888 | E23: >8:49 | J23: 0.38194444444444442 | K23: >9:25 | N23: >8:18 | S23: 0.34722222222222227 | U23: =COUNTA(C23,F23,I23,L23,R23) -> 0 | V23: =COUNTA(D23,G23,J23,M23,S23) -> 3 | W23: =COUNTA(E23,H23,K23,N23,T23) -> 3 | X23: =IF(W23>=3,"DQ","") -> DQ
A24: Obrien, Dan | B24: 77 | U24: =COUNTA(C24,F24,I24,L24,R24) -> 0 | V24: =COUNTA(D24,G24,J24,M24,S24) -> 0 | W24: =COUNTA(E24,H24,K24,N24,T24) -> 0 | X24: =IF(W24>=3,"DQ","") -> 
A25: Rado, Diana | B25: 78 | D25: 0.35138888888888892 | M25: 0.35833333333333334 | U25: =COUNTA(C25,F25,I25,L25,R25) -> 0 | V25: =COUNTA(D25,G25,J25,M25,S25) -> 2 | W25: =COUNTA(E25,H25,K25,N25,T25) -> 0 | X25: =IF(W25>=3,"DQ","") -> 
A26: Randall, John | B26: 91 | U26: =COUNTA(C26,F26,I26,L26,R26) -> 0 | V26: =COUNTA(D26,G26,J26,M26,S26) -> 0 | W26: =COUNTA(E26,H26,K26,N26,T26) -> 0 | X26: =IF(W26>=3,"DQ","") -> 
A27: Randall, Susan | B27: 79 | C27: 0.32847222222222222 | D27: 0.37013888888888885 | U27: =COUNTA(C27,F27,I27,L27,R27) -> 1 | V27: =COUNTA(D27,G27,J27,M27,S27) -> 1 | W27: =COUNTA(E27,H27,K27,N27,T27) -> 0 | X27: =IF(W27>=3,"DQ","") -> 
A28: Rogosheske, Phil | B28: 80 | K28: >9:22 | U28: =COUNTA(C28,F28,I28,L28,R28) -> 0 | V28: =COUNTA(D28,G28,J28,M28,S28) -> 0 | W28: =COUNTA(E28,H28,K28,N28,T28) -> 1 | X28: =IF(W28>=3,"DQ","") -> 
A29: Taylor, Erin | B29: 92 | I29: 0.33124999999999999 | L29: 0.36180555555555555 | O29: X | U29: =COUNTA(C29,F29,I29,L29,R29) -> 2 | V29: =COUNTA(D29,G29,J29,M29,S29) -> 0 | W29: =COUNTA(E29,H29,K29,N29,T29) -> 0 | X29: =IF(W29>=3,"DQ","") -> 
A30: Tegtmeier, Chris | B30: 94 | U30: =COUNTA(C30,F30,I30,L30,R30) -> 0 | V30: =COUNTA(D30,G30,J30,M30,S30) -> 0 | W30: =COUNTA(E30,H30,K30,N30,T30) -> 0 | X30: =IF(W30>=3,"DQ","") -> 
A31: Tichy, Walda | B31: 85 | D31: 0.36944444444444446 | E31: >9:22 | P31: X | U31: =COUNTA(C31,F31,I31,L31,R31) -> 0 | V31: =COUNTA(D31,G31,J31,M31,S31) -> 1 | W31: =COUNTA(E31,H31,K31,N31,T31) -> 1 | X31: =IF(W31>=3,"DQ","") -> 
A32: Topham, Debbie | B32: 84 | U32: =COUNTA(C32,F32,I32,L32,R32) -> 0 | V32: =COUNTA(D32,G32,J32,M32,S32) -> 0 | W32: =COUNTA(E32,H32,K32,N32,T32) -> 0 | X32: =IF(W32>=3,"DQ","") -> 
A33: Wiggins, Michael J | B33: 81 | U33: =COUNTA(C33,F33,I33,L33,R33) -> 0 | V33: =COUNTA(D33,G33,J33,M33,S33) -> 0 | W33: =COUNTA(E33,H33,K33,N33,T33) -> 0 | X33: =IF(W33>=3,"DQ","") -> 
A34: by judge summary | C34: =COUNTA(C5:C33) -> 4 | D34: =COUNTA(D5:D33) -> 9 | E34: =COUNTA(E5:E33) -> 4 | F34: =COUNTA(F5:F33) -> 1 | G34: =COUNTA(G5:G33) -> 2 | H34: =COUNTA(H5:H33) -> 0 | I34: =COUNTA(I5:I33) -> 3 | J34: =COUNTA(J5:J33) -> 3 | K34: =COUNTA(K5:K33) -> 4 | L34: =COUNTA(L5:L33) -> 2 | M34: =COUNTA(M5:M33) -> 3 | N34: =COUNTA(N5:N33) -> 2 | O34: =COUNTA(O5:O33) -> 2 | P34: =COUNTA(P5:P33) -> 2 | Q34: =COUNTA(Q5:Q33) -> 0 | R34: =COUNTA(R5:R33) -> 1 | S34: =COUNTA(S5:S33) -> 5 | T34: =COUNTA(T5:T33) -> 0 | U34: =SUM(U5:U33) -> 11 | V34: =SUM(V5:V33) -> 22 | W34: =SUM(W5:W33) -> 10 | X34: =COUNTIF(W5:W33,">=3") -> 2

A1: Home | Weekly Walks | Courses | Events | Results | Links Copyright 2013 by Twin Cities Race Walkers. All Rights Reserved Contact Webmaster if you have any issues or problems with this web site.