B2: Home | Weekly Walks | Courses | Results | Links

A1: November 10 - TCRW Fall Fling Racewalk Judges: Bruce Leasure, Anita Macias-Howard Certified Course: MN 05045 RR Weather: 33 degrees Fahrenheit, dusting of sleet/snow/rain at the beginning, cloudy The Gory Details October 20 - TCRW Distance Classic Racewalk Judges: Bruce Leasure, Gary Westlund, Jeannie DeMartino Certified Course: MN 05045 RR Weather: 45 degrees Fahrenheit, partly cloudy How close did Chris Tegtmeir come? His actual time was 1:35:58.27, so he had 1.82 seconds to spare! This was the first day it didn't rain in the last 17 days. It's supposed to rain tomorrow too! The Gory Details August 19 - USA 15km Race Walking Championships So many results, it has it's own web page! results July 14 - USATF/MN 10km Race Walking Championships Results Racewalk Judges: Bruce Leasure, Lauren Hill, Tish Borgen Certified Course: MN 05029 RR for 5km and 10km Weather: 65 degrees Fahrenheit, clear Pace June 2-3 - FANS 24 Hour & Centurion USA 2007 Dave Daubert won the walking division, completing over 80 miles in 24 hours. Pictures Complete results are available on the FANS website: http://fans24hour.org. For information on the Centurion USA 2007 itself, see go to http://groups.yahoo.com, and access the ultrawalking group. May 12 - USATF/MN 20km Race Walking Championships Racewalk Judges: Bruce Leasure, Ed Mullaney; Dave Daubert, Tish Borgen Certified Course: MN 05029 RR for 5km and 10km; MN 05041 RR for 20km Weather: 65 degrees Fahrenheit, clear Detailed Pace Information: April 14 - USATF/MN 5km Race Walking Championships - picture Racewalk Judges: Bruce Leasure, Ed Mullaney Certified Course: MN-05045-RR Weather: 45 degrees Fahrenheit, clear 2006 Results

A1: Name | B1: Age Group | C1: Distance | D1: Time | E1: Type
A2: Bernie Finch | B2: M:65-69 | C2: 10k | D2: 5.1400462962962967E-2 | E2: Race Walk
A3: Kathy Finch | B3: F:50-54 | C3: 10k | D3: 5.2118055555555563E-2 | E3: Race Walk
A4: Bill Ingham | B4: M:55-59 | C4: 10k | D4: 5.6157407407407406E-2 | E4: Walk
A6: Dave Daubert | B6: M:60-64 | C6: 5k | D6: 2.2939814814814816E-2 | E6: Race Walk
A7: Bernie Finch | B7: M:65-69 | C7: 5k | D7: 2.5023148148148145E-2 | E7: Race Walk
A8: Kathy Finch | B8: F:50-54 | C8: 5k | D8: 2.6284722222222223E-2 | E8: Race Walk
A9: Anand Gopinath | B9: M:60-64 | C9: 5k | D9: 2.809027777777778E-2 | E9: Race Walk
A10: Bill Ingham | B10: M:55-59 | C10: 5k | D10: 2.809027777777778E-2 | E10: Walk

A1: Time | B1: Lap | C1: Lap Time
A3: 5.5208333333333333E-3 | B3: 1 | C3: 5.5208333333333333E-3 | D3: Bill Ingham
A4: 1.1157407407407408E-2 | B4: 2 | C4: 5.6365740740740742E-3 | D4: Walk
A5: 1.5752314814814813E-2 | B5: 3 | C5: 4.5949074074074052E-3
A6: 2.2453703703703708E-2 | B6: 4 | C6: 6.7013888888888956E-3
A7: 2.809027777777778E-2 | B7: 5 | C7: 5.6365740740740716E-3
A8: 3.3761574074074076E-2 | B8: 6 | C8: 5.6712962962962958E-3
A9: 3.9432870370370368E-2 | B9: 7 | C9: 5.6712962962962923E-3
A10: 4.5127314814814821E-2 | B10: 8 | C10: 5.6944444444444534E-3
A11: 5.0682870370370371E-2 | B11: 9 | C11: 5.5555555555555497E-3
A12: 5.6157407407407406E-2 | B12: 10 | C12: 5.4745370370370347E-3
A14: 4.6643518518518518E-3 | B14: 1 | C14: 4.6643518518518518E-3 | D14: Bernie Finch
A15: 9.3402777777777772E-3 | B15: 2 | C15: 4.6759259259259254E-3 | D15: Race Walk
A16: 1.4432870370370372E-2 | B16: 3 | C16: 5.0925925925925947E-3
A17: 1.9652777777777779E-2 | B17: 4 | C17: 5.2199074074074075E-3
A18: 2.5023148148148145E-2 | B18: 5 | C18: 5.3703703703703656E-3
A19: 3.0868055555555555E-2 | B19: 6 | C19: 5.8449074074074098E-3
A20: 3.5960648148148151E-2 | B20: 7 | C20: 5.0925925925925965E-3
A21: 4.1041666666666664E-2 | B21: 8 | C21: 5.0810185185185125E-3
A22: 4.6180555555555558E-2 | B22: 9 | C22: 5.1388888888888942E-3
A23: 5.1400462962962967E-2 | B23: 10 | C23: 5.2199074074074092E-3
A25: 5.2430555555555555E-3 | B25: 1 | C25: 5.2430555555555555E-3 | D25: Kathy Finch
A26: 1.0486111111111111E-2 | B26: 2 | C26: 5.2430555555555555E-3 | D26: Race Walk
A27: 1.5752314814814813E-2 | B27: 3 | C27: 5.2662037037037018E-3
A28: 2.1053240740740744E-2 | B28: 4 | C28: 5.3009259259259311E-3
A29: 2.6284722222222223E-2 | B29: 5 | C29: 5.2314814814814793E-3
A30: 3.1493055555555559E-2 | B30: 6 | C30: 5.2083333333333356E-3
A31: 3.6689814814814821E-2 | B31: 7 | C31: 5.1967592592592621E-3
A32: 4.1863425925925929E-2 | B32: 8 | C32: 5.173611111111108E-3
A33: 4.7071759259259265E-2 | B33: 9 | C33: 5.2083333333333356E-3
A34: 5.2118055555555563E-2 | B34: 10 | C34: 5.0462962962962987E-3
A36: 5.5092592592592589E-3 | B36: 1 | C36: 5.5092592592592589E-3 | D36: Anand Gopinath
A37: 1.113425925925926E-2 | B37: 2 | C37: 5.6249999999999998E-3 | D37: Race Walk
A38: 1.5752314814814813E-2 | B38: 3 | C38: 4.6180555555555523E-3
A39: 2.2453703703703708E-2 | B39: 4 | C39: 6.7013888888888956E-3
A40: 2.809027777777778E-2 | B40: 5 | C40: 5.6365740740740716E-3
A42: 4.6643518518518518E-3 | B42: 1 | C42: 4.6643518518518518E-3 | D42: Dave Daubert
A43: 9.3171296296296283E-3 | B43: 2 | C43: 4.6527777777777765E-3 | D43: Race Walk
A44: 1.3923611111111111E-2 | B44: 3 | C44: 4.6064814814814822E-3
A45: 1.8472222222222223E-2 | B45: 4 | C45: 4.5486111111111126E-3
A46: 2.2939814814814816E-2 | B46: 5 | C46: 4.4675925925925924E-3

A1: Name | B1: Age Group | C1: Time | D1: km | E1: Comment
A2: Chris Tegtmeir | B2: M:Open | C2: 6.6655092592592599E-2 | D2: 20 | E2: Olympic Trials Qualifying
A3: Jamie Burmeister | B3: F:Open | C3: 8.68287037037037E-2 | D3: 20 | E3: PR!
A5: Chris Tegtmeir | B5: M:Open | C5: 3.3171296296296296E-2 | D5: 10
A6: Jamie Burmeister | B6: F:Open | C6: 4.2106481481481488E-2 | D6: 10
A7: Dave Daubert | B7: M:60-64 | C7: 4.4780092592592587E-2 | D7: 10
A8: Anita Macias-Howard | B8: F:50-54 | C8: 4.4791666666666667E-2 | D8: 10
A10: Chris Tegtmeir | B10: M:Open | C10: 1.6446759259259262E-2 | D10: 5
A11: Tom Stolee | B11: M:Open | C11: 1.877314814814815E-2 | D11: 5
A12: Jamie Burmeister | B12: F:Open | C12: 2.0381944444444446E-2 | D12: 5
A13: Anita Macias-Howard | B13: F:50-54 | C13: 2.2164351851851852E-2 | D13: 5
A14: Dave Daubert | B14: M:60-64 | C14: 2.2164351851851852E-2 | D14: 5
A16: Anita Macias-Howard | B16: F:50-54 | C16: 4.1666666666666664E-2 | D16: 9.3070000000000004 | E16: 1 hour
A17: Dave Daubert | B17: M:60-64 | C17: 4.1666666666666664E-2 | D17: 9.3070000000000004 | E17: 1 hour

A1: Bib | B1: Time | C1: km | D1: pace this km | E1: Name & Info
A2: 74 | B2: 4.5023148148148149E-3 | C2: =IF(A2=A1,C1+1,1) -> 1 | D2: =IF(A2=A1,B2-B1,B2) -> 4.5023148148148149E-3 | E2: Anita Macias-Howard
A3: 74 | B3: 8.9004629629629625E-3 | C3: =IF(A3=A2,C2+1,1) -> 2 | D3: =IF(A3=A2,B3-B2,B3) -> 4.3981481481481476E-3 | E3: F:50-54
A4: 74 | B4: 1.329861111111111E-2 | C4: =IF(A4=A3,C3+1,1) -> 3 | D4: =IF(A4=A3,B4-B3,B4) -> 4.3981481481481476E-3
A5: 74 | B5: 1.7696759259259259E-2 | C5: =IF(A5=A4,C4+1,1) -> 4 | D5: =IF(A5=A4,B5-B4,B5) -> 4.3981481481481493E-3
A6: 74 | B6: 2.2164351851851852E-2 | C6: =IF(A6=A5,C5+1,1) -> 5 | D6: =IF(A6=A5,B6-B5,B6) -> 4.4675925925925924E-3
A7: 74 | B7: 2.6678240740740738E-2 | C7: =IF(A7=A6,C6+1,1) -> 6 | D7: =IF(A7=A6,B7-B6,B7) -> 4.5138888888888867E-3
A8: 74 | B8: 3.1226851851851853E-2 | C8: =IF(A8=A7,C7+1,1) -> 7 | D8: =IF(A8=A7,B8-B7,B8) -> 4.5486111111111144E-3
A9: 74 | B9: 3.5798611111111107E-2 | C9: =IF(A9=A8,C8+1,1) -> 8 | D9: =IF(A9=A8,B9-B8,B9) -> 4.5717592592592546E-3
A10: 74 | B10: 4.0347222222222222E-2 | C10: =IF(A10=A9,C9+1,1) -> 9 | D10: =IF(A10=A9,B10-B9,B10) -> 4.5486111111111144E-3
A11: 74 | B11: 4.4791666666666667E-2 | C11: =IF(A11=A10,C10+1,1) -> 10 | D11: =IF(A11=A10,B11-B10,B11) -> 4.4444444444444453E-3
A13: 76 | B13: 3.645833333333333E-3 | C13: =IF(A13=A11,C11+1,1) -> 1 | D13: =IF(A13=A11,B13-B11,B13) -> 3.645833333333333E-3 | E13: Jamie Burmeister
A14: 76 | B14: 7.6851851851851847E-3 | C14: =IF(A14=A13,C13+1,1) -> 2 | D14: =IF(A14=A13,B14-B13,B14) -> 4.0393518518518513E-3 | E14: F:Open
A15: 76 | B15: 1.1828703703703704E-2 | C15: =IF(A15=A14,C14+1,1) -> 3 | D15: =IF(A15=A14,B15-B14,B15) -> 4.1435185185185195E-3
A16: 76 | B16: 1.6064814814814813E-2 | C16: =IF(A16=A15,C15+1,1) -> 4 | D16: =IF(A16=A15,B16-B15,B16) -> 4.2361111111111089E-3
A17: 76 | B17: 2.0381944444444446E-2 | C17: =IF(A17=A16,C16+1,1) -> 5 | D17: =IF(A17=A16,B17-B16,B17) -> 4.3171296296296326E-3
A18: 76 | B18: 2.4733796296296295E-2 | C18: =IF(A18=A17,C17+1,1) -> 6 | D18: =IF(A18=A17,B18-B17,B18) -> 4.3518518518518498E-3
A19: 76 | B19: 2.9155092592592594E-2 | C19: =IF(A19=A18,C18+1,1) -> 7 | D19: =IF(A19=A18,B19-B18,B19) -> 4.4212962962962982E-3
A20: 76 | B20: 3.3402777777777774E-2 | C20: =IF(A20=A19,C19+1,1) -> 8 | D20: =IF(A20=A19,B20-B19,B20) -> 4.2476851851851807E-3
A21: 76 | B21: 3.7789351851851852E-2 | C21: =IF(A21=A20,C20+1,1) -> 9 | D21: =IF(A21=A20,B21-B20,B21) -> 4.3865740740740775E-3
A22: 76 | B22: 4.2106481481481488E-2 | C22: =IF(A22=A21,C21+1,1) -> 10 | D22: =IF(A22=A21,B22-B21,B22) -> 4.317129629629636E-3
A23: 76 | B23: 4.6550925925925919E-2 | C23: =IF(A23=A22,C22+1,1) -> 11 | D23: =IF(A23=A22,B23-B22,B23) -> 4.4444444444444314E-3
A24: 76 | B24: 5.0972222222222224E-2 | C24: =IF(A24=A23,C23+1,1) -> 12 | D24: =IF(A24=A23,B24-B23,B24) -> 4.4212962962963051E-3
A25: 76 | B25: 5.5393518518518516E-2 | C25: =IF(A25=A24,C24+1,1) -> 13 | D25: =IF(A25=A24,B25-B24,B25) -> 4.4212962962962912E-3
A26: 76 | B26: 5.9733796296296299E-2 | C26: =IF(A26=A25,C25+1,1) -> 14 | D26: =IF(A26=A25,B26-B25,B26) -> 4.3402777777777832E-3
A27: 76 | B27: 6.4224537037037038E-2 | C27: =IF(A27=A26,C26+1,1) -> 15 | D27: =IF(A27=A26,B27-B26,B27) -> 4.4907407407407396E-3
A28: 76 | B28: 6.8773148148148153E-2 | C28: =IF(A28=A27,C27+1,1) -> 16 | D28: =IF(A28=A27,B28-B27,B28) -> 4.5486111111111144E-3
A29: 76 | B29: 7.3333333333333334E-2 | C29: =IF(A29=A28,C28+1,1) -> 17 | D29: =IF(A29=A28,B29-B28,B29) -> 4.560185185185181E-3
A30: 76 | B30: 7.7881944444444448E-2 | C30: =IF(A30=A29,C29+1,1) -> 18 | D30: =IF(A30=A29,B30-B29,B30) -> 4.5486111111111144E-3
A31: 76 | B31: 8.2488425925925923E-2 | C31: =IF(A31=A30,C30+1,1) -> 19 | D31: =IF(A31=A30,B31-B30,B31) -> 4.6064814814814753E-3
A32: 76 | B32: 8.68287037037037E-2 | C32: =IF(A32=A31,C31+1,1) -> 20 | D32: =IF(A32=A31,B32-B31,B32) -> 4.3402777777777762E-3 | E32: PR!
A34: 77 | B34: 4.5023148148148149E-3 | C34: =IF(A34=A32,C32+1,1) -> 1 | D34: =IF(A34=A32,B34-B32,B34) -> 4.5023148148148149E-3 | E34: Dave Daubert
A35: 77 | B35: 8.9004629629629625E-3 | C35: =IF(A35=A34,C34+1,1) -> 2 | D35: =IF(A35=A34,B35-B34,B35) -> 4.3981481481481476E-3 | E35: M:60-64
A36: 77 | B36: 1.329861111111111E-2 | C36: =IF(A36=A35,C35+1,1) -> 3 | D36: =IF(A36=A35,B36-B35,B36) -> 4.3981481481481476E-3
A37: 77 | B37: 1.7673611111111109E-2 | C37: =IF(A37=A36,C36+1,1) -> 4 | D37: =IF(A37=A36,B37-B36,B37) -> 4.3750000000000004E-3
A38: 77 | B38: 2.2164351851851852E-2 | C38: =IF(A38=A37,C37+1,1) -> 5 | D38: =IF(A38=A37,B38-B37,B38) -> 4.4907407407407431E-3
A39: 77 | B39: 2.6678240740740738E-2 | C39: =IF(A39=A38,C38+1,1) -> 6 | D39: =IF(A39=A38,B39-B38,B39) -> 4.5138888888888867E-3
A40: 77 | B40: 3.1226851851851853E-2 | C40: =IF(A40=A39,C39+1,1) -> 7 | D40: =IF(A40=A39,B40-B39,B40) -> 4.5486111111111144E-3
A41: 77 | B41: 3.5798611111111107E-2 | C41: =IF(A41=A40,C40+1,1) -> 8 | D41: =IF(A41=A40,B41-B40,B41) -> 4.5717592592592546E-3
A42: 77 | B42: 4.0347222222222222E-2 | C42: =IF(A42=A41,C41+1,1) -> 9 | D42: =IF(A42=A41,B42-B41,B42) -> 4.5486111111111144E-3
A43: 77 | B43: 4.4780092592592587E-2 | C43: =IF(A43=A42,C42+1,1) -> 10 | D43: =IF(A43=A42,B43-B42,B43) -> 4.4328703703703648E-3
A45: 78 | B45: 3.1134259259259257E-3 | C45: =IF(A45=A43,C43+1,1) -> 1 | D45: =IF(A45=A43,B45-B43,B45) -> 3.1134259259259257E-3 | E45: Chris Tegtmeir
A46: 78 | B46: 6.4120370370370364E-3 | C46: =IF(A46=A45,C45+1,1) -> 2 | D46: =IF(A46=A45,B46-B45,B46) -> 3.2986111111111107E-3 | E46: M:Open
A47: 78 | B47: 9.780092592592592E-3 | C47: =IF(A47=A46,C46+1,1) -> 3 | D47: =IF(A47=A46,B47-B46,B47) -> 3.3680555555555556E-3
A48: 78 | B48: 1.3148148148148147E-2 | C48: =IF(A48=A47,C47+1,1) -> 4 | D48: =IF(A48=A47,B48-B47,B48) -> 3.3680555555555547E-3
A49: 78 | B49: 1.6446759259259262E-2 | C49: =IF(A49=A48,C48+1,1) -> 5 | D49: =IF(A49=A48,B49-B48,B49) -> 3.298611111111115E-3
A50: 78 | B50: 1.982638888888889E-2 | C50: =IF(A50=A49,C49+1,1) -> 6 | D50: =IF(A50=A49,B50-B49,B50) -> 3.3796296296296283E-3
A51: 78 | B51: 2.3171296296296297E-2 | C51: =IF(A51=A50,C50+1,1) -> 7 | D51: =IF(A51=A50,B51-B50,B51) -> 3.3449074074074076E-3
A52: 78 | B52: 2.6481481481481481E-2 | C52: =IF(A52=A51,C51+1,1) -> 8 | D52: =IF(A52=A51,B52-B51,B52) -> 3.3101851851851834E-3
A53: 78 | B53: 2.9826388888888892E-2 | C53: =IF(A53=A52,C52+1,1) -> 9 | D53: =IF(A53=A52,B53-B52,B53) -> 3.344907407407411E-3
A54: 78 | B54: 3.3171296296296296E-2 | C54: =IF(A54=A53,C53+1,1) -> 10 | D54: =IF(A54=A53,B54-B53,B54) -> 3.3449074074074041E-3
A55: 78 | B55: 3.6516203703703703E-2 | C55: =IF(A55=A54,C54+1,1) -> 11 | D55: =IF(A55=A54,B55-B54,B55) -> 3.3449074074074076E-3
A56: 78 | B56: 3.9872685185185185E-2 | C56: =IF(A56=A55,C55+1,1) -> 12 | D56: =IF(A56=A55,B56-B55,B56) -> 3.3564814814814811E-3
A57: 78 | B57: 4.3298611111111107E-2 | C57: =IF(A57=A56,C56+1,1) -> 13 | D57: =IF(A57=A56,B57-B56,B57) -> 3.4259259259259225E-3
A58: 78 | B58: 4.6724537037037044E-2 | C58: =IF(A58=A57,C57+1,1) -> 14 | D58: =IF(A58=A57,B58-B57,B58) -> 3.4259259259259364E-3
A59: 78 | B59: 5.004629629629629E-2 | C59: =IF(A59=A58,C58+1,1) -> 15 | D59: =IF(A59=A58,B59-B58,B59) -> 3.3217592592592465E-3
A60: 78 | B60: 5.3368055555555551E-2 | C60: =IF(A60=A59,C59+1,1) -> 16 | D60: =IF(A60=A59,B60-B59,B60) -> 3.3217592592592604E-3
A61: 78 | B61: 5.6712962962962965E-2 | C61: =IF(A61=A60,C60+1,1) -> 17 | D61: =IF(A61=A60,B61-B60,B61) -> 3.3449074074074145E-3
A62: 78 | B62: 6.0138888888888888E-2 | C62: =IF(A62=A61,C61+1,1) -> 18 | D62: =IF(A62=A61,B62-B61,B62) -> 3.4259259259259225E-3
A63: 78 | B63: 6.3460648148148155E-2 | C63: =IF(A63=A62,C62+1,1) -> 19 | D63: =IF(A63=A62,B63-B62,B63) -> 3.3217592592592673E-3
A64: 78 | B64: 6.6655092592592599E-2 | C64: =IF(A64=A63,C63+1,1) -> 20 | D64: =IF(A64=A63,B64-B63,B64) -> 3.1944444444444442E-3 | E64: Olympic Trials Qualifier!
A66: 79 | B66: 3.5995370370370369E-3 | C66: =IF(A66=A64,C64+1,1) -> 1 | D66: =IF(A66=A64,B66-B64,B66) -> 3.5995370370370369E-3 | E66: Tom Stolee
A67: 79 | B67: 7.4305555555555548E-3 | C67: =IF(A67=A66,C66+1,1) -> 2 | D67: =IF(A67=A66,B67-B66,B67) -> 3.8310185185185179E-3 | E67: M:Open
A68: 79 | B68: 1.1261574074074071E-2 | C68: =IF(A68=A67,C67+1,1) -> 3 | D68: =IF(A68=A67,B68-B67,B68) -> 3.8310185185185166E-3
A69: 79 | B69: 1.4988425925925926E-2 | C69: =IF(A69=A68,C68+1,1) -> 4 | D69: =IF(A69=A68,B69-B68,B69) -> 3.7268518518518545E-3
A70: 79 | B70: 1.877314814814815E-2 | C70: =IF(A70=A69,C69+1,1) -> 5 | D70: =IF(A70=A69,B70-B69,B70) -> 3.784722222222224E-3

A1: Name | B1: Age-Group | C1: Time
A2: Geoff Karhoff | B2: M:Open | C2: 4.207175925925926E-2
A3: Anita Macias-Howard | B3: F:50-54 | C3: 4.4398148148148152E-2
A4: Bernie Finch | B4: M:65-69 | C4: 4.7453703703703699E-2
A5: Kathy Finch | B5: F:50-54 | C5: 5.1701388888888887E-2

A1: Name | B1: Lap Time | C1: pace/km | D1: pace/mile
A2: Geoff Karhoff | B2: 4.5717592592592589E-3 | C2: =B2/1.25 -> 3.657407407407407E-3 | D2: =C2*1.609344 -> 5.8860266666666662E-3
A3: Geoff Karhoff | B3: 5.115740740740741E-3 | C3: =B3/1.25 -> 4.092592592592593E-3 | D3: =C3*1.609344 -> 6.5863893333333347E-3
A4: Geoff Karhoff | B4: 5.3240740740740748E-3 | C4: =B4/1.25 -> 4.2592592592592595E-3 | D4: =C4*1.609344 -> 6.8546133333333339E-3
A5: Geoff Karhoff | B5: 5.4282407407407422E-3 | C5: =B5/1.25 -> 4.3425925925925941E-3 | D5: =C5*1.609344 -> 6.9887253333333361E-3
A6: Geoff Karhoff | B6: 5.4282407407407404E-3 | C6: =B6/1.25 -> 4.3425925925925923E-3 | D6: =C6*1.609344 -> 6.9887253333333335E-3
A7: Geoff Karhoff | B7: 5.5208333333333325E-3 | C7: =B7/1.25 -> 4.416666666666666E-3 | D7: =C7*1.609344 -> 7.1079359999999996E-3
A8: Geoff Karhoff | B8: 5.4282407407407404E-3 | C8: =B8/1.25 -> 4.3425925925925923E-3 | D8: =C8*1.609344 -> 6.9887253333333335E-3
A9: Geoff Karhoff | B9: 5.2546296296296299E-3 | C9: =B9/1.25 -> 4.2037037037037043E-3 | D9: =C9*1.609344 -> 6.7652053333333347E-3
A10: Anita Macias-Howard | B10: 5.5208333333333333E-3 | C10: =B10/1.25 -> 4.4166666666666668E-3 | D10: =C10*1.609344 -> 7.1079360000000005E-3
A11: Anita Macias-Howard | B11: 5.5671296296296311E-3 | C11: =B11/1.25 -> 4.4537037037037045E-3 | D11: =C11*1.609344 -> 7.1675413333333353E-3
A12: Anita Macias-Howard | B12: 5.5671296296296285E-3 | C12: =B12/1.25 -> 4.4537037037037028E-3 | D12: =C12*1.609344 -> 7.1675413333333327E-3
A13: Anita Macias-Howard | B13: 5.6018518518518474E-3 | C13: =B13/1.25 -> 4.4814814814814778E-3 | D13: =C13*1.609344 -> 7.2122453333333279E-3
A14: Anita Macias-Howard | B14: 5.5671296296296337E-3 | C14: =B14/1.25 -> 4.4537037037037071E-3 | D14: =C14*1.609344 -> 7.1675413333333396E-3
A15: Anita Macias-Howard | B15: 5.6018518518518474E-3 | C15: =B15/1.25 -> 4.4814814814814778E-3 | D15: =C15*1.609344 -> 7.2122453333333279E-3
A16: Anita Macias-Howard | B16: 5.5439814814814831E-3 | C16: =B16/1.25 -> 4.4351851851851861E-3 | D16: =C16*1.609344 -> 7.1377386666666683E-3
A17: Anita Macias-Howard | B17: 5.4282407407407474E-3 | C17: =B17/1.25 -> 4.3425925925925975E-3 | D17: =C17*1.609344 -> 6.9887253333333422E-3
A18: Bernie Finch | B18: 5.8680555555555543E-3 | C18: =B18/1.25 -> 4.6944444444444438E-3 | D18: =C18*1.609344 -> 7.5549759999999997E-3
A19: Bernie Finch | B19: 6.0879629629629626E-3 | C19: =B19/1.25 -> 4.8703703703703704E-3 | D19: =C19*1.609344 -> 7.8381013333333333E-3
A20: Bernie Finch | B20: 6.111111111111114E-3 | C20: =B20/1.25 -> 4.8888888888888914E-3 | D20: =C20*1.609344 -> 7.8679040000000054E-3
A21: Bernie Finch | B21: 5.9490740740740754E-3 | C21: =B21/1.25 -> 4.75925925925926E-3 | D21: =C21*1.609344 -> 7.6592853333333349E-3
A22: Bernie Finch | B22: 6.0879629629629617E-3 | C22: =B22/1.25 -> 4.8703703703703695E-3 | D22: =C22*1.609344 -> 7.8381013333333333E-3
A23: Bernie Finch | B23: 5.972222222222219E-3 | C23: =B23/1.25 -> 4.7777777777777749E-3 | D23: =C23*1.609344 -> 7.6890879999999958E-3
A24: Bernie Finch | B24: 5.6365740740740716E-3 | C24: =B24/1.25 -> 4.5092592592592571E-3 | D24: =C24*1.609344 -> 7.2569493333333301E-3
A25: Bernie Finch | B25: 5.7407407407407407E-3 | C25: =B25/1.25 -> 4.5925925925925926E-3 | D25: =C25*1.609344 -> 7.391061333333334E-3
A26: Kathy Finch | B26: 6.3425925925925915E-3 | C26: =B26/1.25 -> 5.0740740740740729E-3 | D26: =C26*1.609344 -> 8.1659306666666646E-3
A27: Kathy Finch | B27: 6.5162037037037055E-3 | C27: =B27/1.25 -> 5.2129629629629644E-3 | D27: =C27*1.609344 -> 8.3894506666666695E-3
A28: Kathy Finch | B28: 6.4351851851851879E-3 | C28: =B28/1.25 -> 5.14814814814815E-3 | D28: =C28*1.609344 -> 8.285141333333336E-3
A29: Kathy Finch | B29: 6.4351851851851792E-3 | C29: =B29/1.25 -> 5.148148148148143E-3 | D29: =C29*1.609344 -> 8.2851413333333256E-3
A30: Kathy Finch | B30: 6.4351851851851896E-3 | C30: =B30/1.25 -> 5.1481481481481517E-3 | D30: =C30*1.609344 -> 8.2851413333333394E-3
A31: Kathy Finch | B31: 6.5046296296296241E-3 | C31: =B31/1.25 -> 5.2037037037036991E-3 | D31: =C31*1.609344 -> 8.3745493333333264E-3
A32: Kathy Finch | B32: 6.504629629629638E-3 | C32: =B32/1.25 -> 5.2037037037037104E-3 | D32: =C32*1.609344 -> 8.3745493333333438E-3
A33: Kathy Finch | B33: 6.5277777777777712E-3 | C33: =B33/1.25 -> 5.2222222222222166E-3 | D33: =C33*1.609344 -> 8.4043519999999917E-3

A1: Name | B1: Sex | C1: Age | D1: Age-Group | E1: Bib | F1: Type | G1: Distance | H1: Time
A2: Marvin Eisenstein | B2: M | C2: 78 | D2: M:75-79 | E2: 68 | F2: RaceWalk | G2: 5 | H2: 2.6249999999999999E-2
A3: Tish Borgen | B3: F | C3: 43 | D3: F:40-44 | E3: 73 | F3: RaceWalk | G3: 10 | H3: 1:05:46 | I3: 0.1017824074074074
A4: Dave Daubert | B4: M | C4: 61 | D4: M:60-64 | E4: 72 | F4: RaceWalk | G4: 10 | H4: 4.6203703703703698E-2
A5: Chris Kamrath | B5: M | C5: 24 | D5: M:Open | E5: 69 | F5: RaceWalk | G5: 20 | H5: 1:13:31 | I5: 9.0081018518518519E-2
A6: Jamie Burmeister | B6: F | C6: 24 | D6: F:Open | E6: 65 | F6: RaceWalk | G6: 20 | H6: 9.0081018518518519E-2
A7: Bernie Finch | B7: M | C7: 67 | D7: M:65-69 | E7: 71 | F7: RaceWalk | G7: 20 | H7: 0.10148148148148149
A8: Kathy Finch | B8: F | C8: 52 | D8: F:50-54 | E8: 70 | F8: RaceWalk | G8: 20 | H8: 0.10537037037037038
A9: Seymour Pederson | B9: M | C9: 64 | D9: M:60-64 | E9: 513 | F9: Walk | G9: 20 | H9: 0.12540509259259261
A10: Robin Johnson | B10: F | C10: 41 | D10: F:40-44 | E10: 514 | F10: Walk | G10: 20 | H10: 0.12540509259259261
A11: Sally J Nelson | B11: F | C11: 48 | D11: F:45-49 | E11: 512 | F11: Walk | G11: 20 | H11: 0.14024305555555555

A1: bib | B1: Time | C1: LapSize | D1: Lap | E1: Pace/km | F1: Pace/Mile
A2: 65 | B2: 1.0810185185185185E-2 | C2: 2.5 | D2: 1 | E2: =B2/C2 -> 4.3240740740740739E-3 | F2: =E2*1.609344 -> 6.9589226666666665E-3
A3: 65 | B3: 2.210648148148148E-2 | C3: 2.5 | D3: 2 | E3: =(B3-B2)/C3 -> 4.5185185185185181E-3 | F3: =E3*1.609344 -> 7.2718506666666662E-3
A4: 65 | B4: 3.3402777777777774E-2 | C4: 2.5 | D4: 3 | E4: =(B4-B3)/C4 -> 4.5185185185185172E-3 | F4: =E4*1.609344 -> 7.2718506666666653E-3
A5: 65 | B5: 4.4699074074074079E-2 | C5: 2.5 | D5: 4 | E5: =(B5-B4)/C5 -> 4.5185185185185215E-3 | F5: =E5*1.609344 -> 7.2718506666666722E-3
A6: 65 | B6: 5.6111111111111112E-2 | C6: 2.5 | D6: 5 | E6: =(B6-B5)/C6 -> 4.5648148148148132E-3 | F6: =E6*1.609344 -> 7.346357333333331E-3
A7: 65 | B7: 6.7210648148148144E-2 | C7: 2.5 | D7: 6 | E7: =(B7-B6)/C7 -> 4.4398148148148131E-3 | F7: =E7*1.609344 -> 7.1451893333333311E-3
A8: 65 | B8: 7.8599537037037037E-2 | C8: 2.5 | D8: 7 | E8: =(B8-B7)/C8 -> 4.5555555555555575E-3 | F8: =E8*1.609344 -> 7.3314560000000036E-3
A9: 65 | B9: 9.0081018518518519E-2 | C9: 2.5 | D9: 8 | E9: =(B9-B8)/C9 -> 4.5925925925925926E-3 | F9: =E9*1.609344 -> 7.391061333333334E-3
A10: 68 | B10: 6.4236111111111117E-3 | C10: 1.25 | D10: 1 | E10: =B10/C10 -> 5.138888888888889E-3 | F10: =E10*1.609344 -> 8.2702400000000016E-3
A11: 68 | B11: 1.3032407407407407E-2 | C11: 1.25 | D11: 2 | E11: =(B11-B10)/C11 -> 5.2870370370370363E-3 | F11: =E11*1.609344 -> 8.5086613333333321E-3
A12: 68 | B12: 1.9664351851851853E-2 | C12: 1.25 | D12: 3 | E12: =(B12-B11)/C12 -> 5.3055555555555564E-3 | F12: =E12*1.609344 -> 8.5384640000000026E-3
A13: 68 | B13: 2.6249999999999999E-2 | C13: 1.25 | D13: 4 | E13: =(B13-B12)/C13 -> 5.268518518518517E-3 | F13: =E13*1.609344 -> 8.4788586666666652E-3
A14: 69 | B14: 6.238425925925925E-3 | C14: 1.25 | D14: 1 | E14: =B14/C14 -> 4.99074074074074E-3 | F14: =E14*1.609344 -> 8.0318186666666659E-3
A15: 69 | B15: 1.2592592592592593E-2 | C15: 1.25 | D15: 2 | E15: =(B15-B14)/C15 -> 5.0833333333333338E-3 | F15: =E15*1.609344 -> 8.1808320000000007E-3
A16: 69 | B16: 1.8993055555555558E-2 | C16: 1.25 | D16: 3 | E16: =(B16-B15)/C16 -> 5.1203703703703723E-3 | F16: =E16*1.609344 -> 8.2404373333333364E-3
A17: 69 | B17: 2.5289351851851851E-2 | C17: 1.25 | D17: 4 | E17: =(B17-B16)/C17 -> 5.0370370370370343E-3 | F17: =E17*1.609344 -> 8.106325333333329E-3
A18: 69 | B18: 3.1770833333333331E-2 | C18: 1.25 | D18: 5 | E18: =(B18-B17)/C18 -> 5.1851851851851842E-3 | F18: =E18*1.609344 -> 8.3447466666666664E-3
A19: 69 | B19: 3.8402777777777779E-2 | C19: 1.25 | D19: 6 | E19: =(B19-B18)/C19 -> 5.3055555555555581E-3 | F19: =E19*1.609344 -> 8.5384640000000043E-3
A20: 69 | B20: 4.4756944444444446E-2 | C20: 1.25 | D20: 7 | E20: =(B20-B19)/C20 -> 5.0833333333333338E-3 | F20: =E20*1.609344 -> 8.1808320000000007E-3
A21: 69 | B21: 5.1053240740740746E-2 | C21: 1.25 | D21: 8 | E21: =(B21-B20)/C21 -> 5.0370370370370395E-3 | F21: =E21*1.609344 -> 8.1063253333333377E-3
A22: 70 | B22: 1.2905092592592591E-2 | C22: 2.5 | D22: 1 | E22: =B22/C22 -> 5.1620370370370362E-3 | F22: =E22*1.609344 -> 8.3074933333333323E-3
A23: 70 | B23: 2.6064814814814815E-2 | C23: 2.5 | D23: 2 | E23: =(B23-B22)/C23 -> 5.2638888888888891E-3 | F23: =E23*1.609344 -> 8.4714080000000015E-3
A24: 70 | B24: 3.9224537037037037E-2 | C24: 2.5 | D24: 3 | E24: =(B24-B23)/C24 -> 5.2638888888888891E-3 | F24: =E24*1.609344 -> 8.4714080000000015E-3
A25: 70 | B25: 5.2569444444444446E-2 | C25: 2.5 | D25: 4 | E25: =(B25-B24)/C25 -> 5.3379629629629636E-3 | F25: =E25*1.609344 -> 8.5906186666666676E-3
A26: 70 | B26: 6.582175925925926E-2 | C26: 2.5 | D26: 5 | E26: =(B26-B25)/C26 -> 5.3009259259259259E-3 | F26: =E26*1.609344 -> 8.5310133333333336E-3
A27: 70 | B27: 7.9108796296296288E-2 | C27: 2.5 | D27: 6 | E27: =(B27-B26)/C27 -> 5.3148148148148113E-3 | F27: =E27*1.609344 -> 8.5533653333333282E-3
A28: 70 | B28: 9.2175925925925925E-2 | C28: 2.5 | D28: 7 | E28: =(B28-B27)/C28 -> 5.2268518518518549E-3 | F28: =E28*1.609344 -> 8.4118026666666727E-3
A29: 70 | B29: 0.10537037037037038 | C29: 2.5 | D29: 8 | E29: =(B29-B28)/C29 -> 5.2777777777777814E-3 | F29: =E29*1.609344 -> 8.4937600000000064E-3
A30: 71 | B30: 1.2905092592592591E-2 | C30: 2.5 | D30: 1 | E30: =B30/C30 -> 5.1620370370370362E-3 | F30: =E30*1.609344 -> 8.3074933333333323E-3
A31: 71 | B31: 2.6064814814814815E-2 | C31: 2.5 | D31: 2 | E31: =(B31-B30)/C31 -> 5.2638888888888891E-3 | F31: =E31*1.609344 -> 8.4714080000000015E-3
A32: 71 | B32: 3.8842592592592588E-2 | C32: 2.5 | D32: 3 | E32: =(B32-B31)/C32 -> 5.1111111111111097E-3 | F32: =E32*1.609344 -> 8.2255359999999986E-3
A33: 71 | B33: 5.1458333333333328E-2 | C33: 2.5 | D33: 4 | E33: =(B33-B32)/C33 -> 5.0462962962962961E-3 | F33: =E33*1.609344 -> 8.1212266666666668E-3
A34: 71 | B34: 6.3981481481481486E-2 | C34: 2.5 | D34: 5 | E34: =(B34-B33)/C34 -> 5.0092592592592636E-3 | F34: =E34*1.609344 -> 8.0616213333333415E-3
A35: 71 | B35: 7.6504629629629631E-2 | C35: 2.5 | D35: 6 | E35: =(B35-B34)/C35 -> 5.0092592592592576E-3 | F35: =E35*1.609344 -> 8.0616213333333311E-3
A36: 71 | B36: 8.9016203703703708E-2 | C36: 2.5 | D36: 7 | E36: =(B36-B35)/C36 -> 5.0046296296296314E-3 | F36: =E36*1.609344 -> 8.0541706666666709E-3
A37: 71 | B37: 0.10148148148148149 | C37: 2.5 | D37: 8 | E37: =(B37-B36)/C37 -> 4.986111111111113E-3 | F37: =E37*1.609344 -> 8.0243680000000039E-3
A38: 72 | B38: 5.5902777777777782E-3 | C38: 1.25 | D38: 1 | E38: =B38/C38 -> 4.4722222222222229E-3 | F38: =E38*1.609344 -> 7.1973440000000014E-3
A39: 72 | B39: 1.1180555555555556E-2 | C39: 1.25 | D39: 2 | E39: =(B39-B38)/C39 -> 4.4722222222222229E-3 | F39: =E39*1.609344 -> 7.1973440000000014E-3
A40: 72 | B40: 1.6875000000000001E-2 | C40: 1.25 | D40: 3 | E40: =(B40-B39)/C40 -> 4.5555555555555557E-3 | F40: =E40*1.609344 -> 7.331456000000001E-3
A41: 72 | B41: 2.2627314814814819E-2 | C41: 1.25 | D41: 4 | E41: =(B41-B40)/C41 -> 4.6018518518518544E-3 | F41: =E41*1.609344 -> 7.405962666666671E-3
A42: 72 | B42: 2.8425925925925924E-2 | C42: 1.25 | D42: 5 | E42: =(B42-B41)/C42 -> 4.6388888888888842E-3 | F42: =E42*1.609344 -> 7.4655679999999927E-3
A43: 72 | B43: 3.4317129629629628E-2 | C43: 1.25 | D43: 6 | E43: =(B43-B42)/C43 -> 4.7129629629629631E-3 | F43: =E43*1.609344 -> 7.5847786666666675E-3
A44: 72 | B44: 4.0312500000000001E-2 | C44: 1.25 | D44: 7 | E44: =(B44-B43)/C44 -> 4.7962962962962933E-3 | F44: =E44*1.609344 -> 7.7188906666666619E-3
A45: 72 | B45: 4.6203703703703698E-2 | C45: 1.25 | D45: 8 | E45: =(B45-B44)/C45 -> 4.7129629629629631E-3 | F45: =E45*1.609344 -> 7.5847786666666675E-3
A46: 73 | B46: 5.6111111111111112E-2 | C46: 1.25 | D46: 0 | E46: start
A47: 73 | B47: 6.1608796296296293E-2 | C47: 1.25 | D47: 1 | E47: =(B47-B46)/C47 -> 4.3981481481481458E-3 | F47: =E47*1.609344 -> 7.07813333333333E-3
A48: 73 | B48: 6.7210648148148144E-2 | C48: 1.25 | D48: 2 | E48: =(B48-B47)/C48 -> 4.4814814814814804E-3 | F48: =E48*1.609344 -> 7.2122453333333322E-3
A49: 73 | B49: 7.300925925925926E-2 | C49: 1.25 | D49: 3 | E49: =(B49-B48)/C49 -> 4.638888888888892E-3 | F49: =E49*1.609344 -> 7.4655680000000058E-3
A50: 73 | B50: 7.8599537037037037E-2 | C50: 1.25 | D50: 4 | E50: =(B50-B49)/C50 -> 4.4722222222222221E-3 | F50: =E50*1.609344 -> 7.1973440000000005E-3
A51: 73 | B51: 8.443287037037038E-2 | C51: 1.25 | D51: 5 | E51: =(B51-B50)/C51 -> 4.6666666666666749E-3 | F51: =E51*1.609344 -> 7.510272000000014E-3
A52: 73 | B52: 9.015046296296296E-2 | C52: 1.25 | D52: 6 | E52: =(B52-B51)/C52 -> 4.5740740740740637E-3 | F52: =E52*1.609344 -> 7.3612586666666506E-3
A53: 73 | B53: 9.6099537037037039E-2 | C53: 1.25 | D53: 7 | E53: =(B53-B52)/C53 -> 4.7592592592592634E-3 | F53: =E53*1.609344 -> 7.6592853333333401E-3
A54: 73 | B54: 0.1017824074074074 | C54: 1.25 | D54: 8 | E54: =(B54-B53)/C54 -> 4.5462962962962931E-3 | F54: =E54*1.609344 -> 7.3165546666666623E-3
A55: 512 | B55: 1.6168981481481482E-2 | C55: 2.5 | D55: 1 | E55: =B55/C55 -> 6.4675925925925925E-3 | F55: =E55*1.609344 -> 1.0408581333333333E-2
A56: 512 | B56: 3.3483796296296296E-2 | C56: 2.5 | D56: 2 | E56: =(B56-B55)/C56 -> 6.9259259259259257E-3 | F56: =E56*1.609344 -> 1.1146197333333333E-2
A57: 512 | B57: 4.9386574074074076E-2 | C57: 2.5 | D57: 3 | E57: =(B57-B56)/C57 -> 6.3611111111111117E-3 | F57: =E57*1.609344 -> 1.0237216000000002E-2
A58: 512 | B58: 6.627314814814815E-2 | C58: 2.5 | D58: 4 | E58: =(B58-B57)/C58 -> 6.7546296296296295E-3 | F58: =E58*1.609344 -> 1.0870522666666667E-2
A59: 512 | B59: 8.3368055555555556E-2 | C59: 2.5 | D59: 5 | E59: =(B59-B58)/C59 -> 6.8379629629629624E-3 | F59: =E59*1.609344 -> 1.1004634666666666E-2
A60: 512 | B60: 0.10104166666666665 | C60: 2.5 | D60: 6 | E60: =(B60-B59)/C60 -> 7.069444444444439E-3 | F60: =E60*1.609344 -> 1.1377167999999991E-2
A61: 512 | B61: 0.12002314814814814 | C61: 2.5 | D61: 7 | E61: =(B61-B60)/C61 -> 7.5925925925925952E-3 | F61: =E61*1.609344 -> 1.2219093333333339E-2
A62: 512 | B62: 0.14024305555555555 | C62: 2.5 | D62: 8 | E62: =(B62-B61)/C62 -> 8.0879629629629635E-3 | F62: =E62*1.609344 -> 1.3016314666666669E-2
A63: 513 | B63: 1.5150462962962963E-2 | C63: 2.5 | D63: 1 | E63: =B63/C63 -> 6.0601851851851849E-3 | F63: =E63*1.609344 -> 9.752922666666667E-3
A64: 513 | B64: 3.050925925925926E-2 | C64: 2.5 | D64: 2 | E64: =(B64-B63)/C64 -> 6.1435185185185186E-3 | F64: =E64*1.609344 -> 9.8870346666666675E-3
A65: 513 | B65: 4.5648148148148153E-2 | C65: 2.5 | D65: 3 | E65: =(B65-B64)/C65 -> 6.0555555555555571E-3 | F65: =E65*1.609344 -> 9.7454720000000033E-3
A66: 513 | B66: 6.21875E-2 | C66: 2.5 | D66: 4 | E66: =(B66-B65)/C66 -> 6.6157407407407389E-3 | F66: =E66*1.609344 -> 1.0647002666666664E-2
A67: 513 | B67: 7.7604166666666669E-2 | C67: 2.5 | D67: 5 | E67: =(B67-B66)/C67 -> 6.1666666666666675E-3 | F67: =E67*1.609344 -> 9.9242880000000016E-3
A68: 513 | B68: 9.3425925925925926E-2 | C68: 2.5 | D68: 6 | E68: =(B68-B67)/C68 -> 6.3287037037037027E-3 | F68: =E68*1.609344 -> 1.0185061333333332E-2
A69: 513 | B69: 0.10971064814814814 | C69: 2.5 | D69: 7 | E69: =(B69-B68)/C69 -> 6.5138888888888859E-3 | F69: =E69*1.609344 -> 1.0483087999999996E-2
A70: 513 | B70: 0.12540509259259261 | C70: 2.5 | D70: 8 | E70: =(B70-B69)/C70 -> 6.2777777777777875E-3 | F70: =E70*1.609344 -> 1.0103104000000016E-2
A71: 514 | B71: 1.5150462962962963E-2 | C71: 2.5 | D71: 1 | E71: =B71/C71 -> 6.0601851851851849E-3 | F71: =E71*1.609344 -> 9.752922666666667E-3
A72: 514 | B72: 3.050925925925926E-2 | C72: 2.5 | D72: 2 | E72: =(B72-B71)/C72 -> 6.1435185185185186E-3 | F72: =E72*1.609344 -> 9.8870346666666675E-3
A73: 514 | B73: 4.5648148148148153E-2 | C73: 2.5 | D73: 3 | E73: =(B73-B72)/C73 -> 6.0555555555555571E-3 | F73: =E73*1.609344 -> 9.7454720000000033E-3
A74: 514 | B74: 6.1921296296296301E-2 | C74: 2.5 | D74: 4 | E74: =(B74-B73)/C74 -> 6.5092592592592589E-3 | F74: =E74*1.609344 -> 1.0475637333333333E-2
A75: 514 | B75: 7.7604166666666669E-2 | C75: 2.5 | D75: 5 | E75: =(B75-B74)/C75 -> 6.2731481481481475E-3 | F75: =E75*1.609344 -> 1.0095653333333333E-2
A76: 514 | B76: 9.3437500000000007E-2 | C76: 2.5 | D76: 6 | E76: =(B76-B75)/C76 -> 6.3333333333333349E-3 | F76: =E76*1.609344 -> 1.0192512000000003E-2
A77: 514 | B77: 0.10971064814814814 | C77: 2.5 | D77: 7 | E77: =(B77-B76)/C77 -> 6.5092592592592537E-3 | F77: =E77*1.609344 -> 1.0475637333333326E-2
A78: 514 | B78: 0.12540509259259261 | C78: 2.5 | D78: 8 | E78: =(B78-B77)/C78 -> 6.2777777777777875E-3 | F78: =E78*1.609344 -> 1.0103104000000016E-2

D1: Pace/km for each km
A2: Name | B2: AgeGroup | C2: Time | D2: 1 | E2: 2 | F2: 3 | G2: 4 | H2: 5
A3: Lori Holcomb | B3: F:40-44 | C3: 2.1840277777777778E-2 | D3: 4.3055555555555555E-3 | E3: 4.3287037037037044E-3 | F3: 4.4097222222222229E-3 | G3: 4.4907407407407396E-3 | H3: 4.3055555555555555E-3
A4: Dave Daubert | B4: M:60-64 | C4: 2.193287037037037E-2 | D4: 4.2476851851851851E-3 | E4: 4.31712962962963E-3 | F4: 4.4675925925925924E-3 | G4: 4.4560185185185171E-3 | H4: 4.4444444444444453E-3
A5: Chris Kamrath | B5: M:19-34 | C5: 2.2037037037037036E-2 | D5: 4.4444444444444444E-3 | E5: 4.4328703703703709E-3 | F5: 4.3981481481481476E-3 | G5: 4.4444444444444436E-3 | H5: 4.3171296296296291E-3
A6: Stanley Adkins | B6: M:80+ | C6: 2.2743055555555555E-2 | D6: 4.5486111111111109E-3 | E6: 4.6180555555555558E-3 | F6: 4.5370370370370373E-3 | G6: 4.5486111111111109E-3 | H6: 4.4907407407407396E-3

A1: Home | Weekly Walks | Courses | Results | Links Copyright 2013 by Twin Cities Race Walkers. All Rights Reserved Contact Webmaster if you have any issues or problems with this web site.